[
    {
        "name": "Magic Hero Figurine - Red",
        "price": 5000000,
        "type": "Collection",
        "shape": "2x3",
        "description": "",
        "name_color": "red"
    },
    {
        "name": "Chaos Orb",
        "price": 3000000,
        "type": "Gem",
        "shape": "1x1",
        "description": "",
        "name_color": "red"
    },
    {
        "name": "Eternal Talisman",
        "price": 1500000,
        "type": "Accessory",
        "shape": "2x2",
        "description": "",
        "name_color": "red"
    },
    {
        "name": "Celebration Cake",
        "price": 1000000,
        "type": "Food",
        "shape": "4x4",
        "description": "",
        "name_color": "red"
    },
    {
        "name": "Dark Scale Dragon Robe",
        "price": 950000,
        "type": "Armor",
        "shape": "2x3",
        "description": "",
        "name_color": "red"
    },
    {
        "name": "Great Dragon Spear",
        "price": 880000,
        "type": "Weapon",
        "shape": "1x5",
        "description": "",
        "name_color": "red"
    },
    {
        "name": "Time Potion",
        "price": 800000,
        "type": "Potion",
        "shape": "2x2",
        "description": "",
        "name_color": "red"
    },
    {
        "name": "Spacetime Core",
        "price": 650000,
        "type": "Gem",
        "shape": "3x3",
        "description": "",
        "name_color": "red"
    },
    {
        "name": "Dawnbreak Aegis",
        "price": 600000,
        "type": "Armor",
        "shape": "3x4",
        "description": "",
        "name_color": "red"
    },
    {
        "name": "Realmbreaker Axe",
        "price": 550000,
        "type": "Weapon",
        "shape": "3x5",
        "description": "",
        "name_color": "red"
    },
    {
        "name": "Dawn Origin Crystal",
        "price": 510000,
        "type": "Mineral",
        "shape": "2x3",
        "description": "",
        "name_color": "red"
    },
    {
        "name": "Magic Hero Figurine - Gold",
        "price": 500000,
        "type": "Collection",
        "shape": "2x3",
        "description": "",
        "name_color": "gold"
    },
    {
        "name": "Firmament Bow",
        "price": 480000,
        "type": "Weapon",
        "shape": "2x5",
        "description": "",
        "name_color": "red"
    },
    {
        "name": "Origin Armor",
        "price": 440000,
        "type": "Armor",
        "shape": "4x4",
        "description": "",
        "name_color": "red"
    },
    {
        "name": "Dew of Foresight",
        "price": 400000,
        "type": "Potion",
        "shape": "1x2",
        "description": "",
        "name_color": "red"
    },
    {
        "name": "Holy Core",
        "price": 380000,
        "type": "Material",
        "shape": "2x1",
        "description": "",
        "name_color": "red"
    },
    {
        "name": "Annihilation Blade",
        "price": 350000,
        "type": "Weapon",
        "shape": "2x4",
        "description": "",
        "name_color": "red"
    },
    {
        "name": "Sacred Beast Pendant",
        "price": 330000,
        "type": "Accessory",
        "shape": "1x3",
        "description": "",
        "name_color": "red"
    },
    {
        "name": "Bane's Ship in a Bottle",
        "price": 300000,
        "type": "Accessory",
        "shape": "3x2",
        "description": "",
        "name_color": "red"
    },
    {
        "name": "Thunder Core",
        "price": 280000,
        "type": "Material",
        "shape": "3x3",
        "description": "",
        "name_color": "red"
    },
    {
        "name": "X.Borg Armor",
        "price": 270000,
        "type": "Armor",
        "shape": "3x5",
        "description": "",
        "name_color": "red"
    },
    {
        "name": "Mechanical Divine Heart",
        "price": 250000,
        "type": "Material",
        "shape": "4x4",
        "description": "",
        "name_color": "red"
    },
    {
        "name": "Malefic Gun",
        "price": 240000,
        "type": "Weapon",
        "shape": "4x2",
        "description": "",
        "name_color": "red"
    },
    {
        "name": "Star-Core Jar",
        "price": 220000,
        "type": "Accessory",
        "shape": "2x1",
        "description": "",
        "name_color": "red"
    },
    {
        "name": "Dragon Jade",
        "price": 210000,
        "type": "Gem",
        "shape": "1x2",
        "description": "",
        "name_color": "red"
    },
    {
        "name": "Shadow Avatar",
        "price": 200000,
        "type": "Material",
        "shape": "3x3",
        "description": "",
        "name_color": "red"
    },
    {
        "name": "Eternal Ice Crystal",
        "price": 199000,
        "type": "Potion",
        "shape": "1x1",
        "description": "",
        "name_color": "red"
    },
    {
        "name": "Eternal Chalice",
        "price": 190000,
        "type": "Material",
        "shape": "2x4",
        "description": "",
        "name_color": "red"
    },
    {
        "name": "Great Dragon Pill",
        "price": 184000,
        "type": "Potion",
        "shape": "1x1",
        "description": "",
        "name_color": "red"
    },
    {
        "name": "Shendu Pastry",
        "price": 180000,
        "type": "Food",
        "shape": "2x2",
        "description": "",
        "name_color": "red"
    },
    {
        "name": "Angela's Doll",
        "price": 180000,
        "type": "Accessory",
        "shape": "1x2",
        "description": "",
        "name_color": "red"
    },
    {
        "name": "War Axe",
        "price": 180000,
        "type": "Weapon",
        "shape": "5x3",
        "description": "",
        "name_color": "gold"
    },
    {
        "name": "Meteorite Core",
        "price": 180000,
        "type": "Mineral",
        "shape": "3x3",
        "description": "",
        "name_color": "red"
    },
    {
        "name": "Heart of the Abyss",
        "price": 150000,
        "type": "Gem",
        "shape": "2x2",
        "description": "",
        "name_color": "red"
    },
    {
        "name": "Chaos Stone",
        "price": 150000,
        "type": "Mineral",
        "shape": "2x2",
        "description": "",
        "name_color": "red"
    },
    {
        "name": "Stargate Elixir",
        "price": 150000,
        "type": "Food",
        "shape": "1x1",
        "description": "",
        "name_color": "red"
    },
    {
        "name": "Soulbloom Umbrella",
        "price": 150000,
        "type": "Accessory",
        "shape": "3x3",
        "description": "",
        "name_color": "gold"
    },
    {
        "name": "Phantom Armor",
        "price": 140000,
        "type": "Armor",
        "shape": "3x4",
        "description": "",
        "name_color": "red"
    },
    {
        "name": "Holy Shield",
        "price": 135000,
        "type": "Armor",
        "shape": "4x4",
        "description": "",
        "name_color": "gold"
    },
    {
        "name": "Moon Cone",
        "price": 130000,
        "type": "Food",
        "shape": "2x2",
        "description": "",
        "name_color": "red"
    },
    {
        "name": "Abyssal Essence",
        "price": 130000,
        "type": "Mineral",
        "shape": "1x2",
        "description": "",
        "name_color": "red"
    },
    {
        "name": "Omni Soulstone",
        "price": 120000,
        "type": "Gem",
        "shape": "1x1",
        "description": "",
        "name_color": "red"
    },
    {
        "name": "Romantic Fountain",
        "price": 120000,
        "type": "Material",
        "shape": "4x4",
        "description": "",
        "name_color": "gold"
    },
    {
        "name": "Abyssal Crown",
        "price": 120000,
        "type": "Accessory",
        "shape": "2x2",
        "description": "",
        "name_color": "gold"
    },
    {
        "name": "Sunflare Core",
        "price": 110000,
        "type": "Material",
        "shape": "1x1",
        "description": "",
        "name_color": "red"
    },
    {
        "name": "Mystic Dragon Reishi",
        "price": 108000,
        "type": "Potion",
        "shape": "2x2",
        "description": null,
        "name_color": "red"
    },
    {
        "name": "Raging Scythe",
        "price": 105000,
        "type": "Weapon",
        "shape": "2x4",
        "description": null,
        "name_color": "red"
    },
    {
        "name": "Auction Item - Red",
        "price": 100000,
        "type": "Auction Item",
        "shape": "1x1",
        "description": null,
        "name_color": "red"
    },
    {
        "name": "Divine Crossbow",
        "price": 100000,
        "type": "Weapon",
        "shape": "2x2",
        "description": null,
        "name_color": "gold"
    },
    {
        "name": "Magic Hero Figurine - Purple",
        "price": 100000,
        "type": "Collection",
        "shape": "2x3",
        "description": null,
        "name_color": "purple"
    },
    {
        "name": "Dark System",
        "price": 99999,
        "type": "Material",
        "shape": "1x1",
        "description": null,
        "name_color": "red"
    },
    {
        "name": "Strange Fruit",
        "price": 99000,
        "type": "Potion",
        "shape": "1x1",
        "description": null,
        "name_color": "red"
    },
    {
        "name": "Raging Cloak",
        "price": 98000,
        "type": "Armor",
        "shape": "2x3",
        "description": null,
        "name_color": "red"
    },
    {
        "name": "Tai Chi Stone",
        "price": 95000,
        "type": "Gem",
        "shape": "2x2",
        "description": null,
        "name_color": "red"
    },
    {
        "name": "Savage Beast Bone",
        "price": 95000,
        "type": "Material",
        "shape": "3x3",
        "description": null,
        "name_color": "gold"
    },
    {
        "name": "Tharz",
        "price": 90000,
        "type": "Accessory",
        "shape": "1x1",
        "description": null,